{
  "schemaVersion": 2,
  "id": "forest-flight",
  "status": "scaffolded",
  "createdAt": "2026-09-26T03:51:56.060Z",
  "source": {
    "path": "_tech9/baseline",
    "version": "1.3.0",
    "commit": "0e03621d8aa488666754f0325da3651000509a0c",
    "snapshotSha256": "e08ba290b9389e54a0ab702e956bf7506994e64c451f5b808c35e06ada2ba3a2",
    "files": [
      {
        "path": ".gitignore",
        "bytes": 72,
        "sha256": "2b9976c4c1600e25a5a49397eea5802c4385c365ceea91c4a2b82e6c61c619d6"
      },
      {
        "path": ".prettierignore",
        "bytes": 149,
        "sha256": "bce6f3cfd38c68913a008d3e150a11f30dea9058acca771527bcd4a80f887ebd"
      },
      {
        "path": ".prettierrc.json",
        "bytes": 26,
        "sha256": "37055c98043228133ffcc5cad7bba5ef6c8f24698a551cae547b90f51d22e519"
      },
      {
        "path": "ARCHITECTURE.md",
        "bytes": 9249,
        "sha256": "7f0f5715f46d59a28b776a583b8380792913cc2bed46c09f86b074db08891434"
      },
      {
        "path": "art/acquire_groundcover.py",
        "bytes": 2692,
        "sha256": "cefd7956d77fe73d53dc1fd7ddbfe9fd094438e3d46d40ffb5c0d9d5e001562f"
      },
      {
        "path": "art/asset-report.json",
        "bytes": 1022,
        "sha256": "43778a0b4c148cb192b638c0f91db142094d6b82b9d1e5f3bd4e8b3dad079b2b"
      },
      {
        "path": "art/build_forest.py",
        "bytes": 20170,
        "sha256": "aed90f375194f6ab841d0706ba4b8492d1e03b042f550ad918fae838335d1684"
      },
      {
        "path": "art/forest-kit.blend",
        "bytes": 9984421,
        "sha256": "a27e5fc1ce5faeeb9f8d9028c57b6edf993ad3ed315ddab80b884f5b45d98fc3"
      },
      {
        "path": "art/generate_needles.py",
        "bytes": 4403,
        "sha256": "d6098cc602178f8b1abbe9aed4b01648643b46193f2d19e1346dd19a7a4e78f4"
      },
      {
        "path": "art/sources/fern_02/fern_02.bin",
        "bytes": 45088,
        "sha256": "865c20b7954e714c0e8692c1c9f99a72c9ab6ff6cfcef5ddf21bf88d625d9257"
      },
      {
        "path": "art/sources/fern_02/fern_02.gltf",
        "bytes": 2463,
        "sha256": "48b744a24e6108850bca1efa4096e29d8a355e4101a2a40c31836e376abd74e0"
      },
      {
        "path": "art/sources/fern_02/textures/fern_02_alpha_1k.png",
        "bytes": 114589,
        "sha256": "ea3c64284c7ebdeedf484d2d816eae92825ec526140c3bb83859ddc7a64001f9"
      },
      {
        "path": "art/sources/fern_02/textures/fern_02_arm_1k.jpg",
        "bytes": 280359,
        "sha256": "ebfb5d76ce9cbdaec20bcd22dce9b755f0b1b8650ef29ca13555e3e6961025d7"
      },
      {
        "path": "art/sources/fern_02/textures/fern_02_diff_1k.jpg",
        "bytes": 315705,
        "sha256": "a828a6e7b4c01c826911e2eac4b3afc7457dab7b3b392a31c681ed88b7d50029"
      },
      {
        "path": "art/sources/fern_02/textures/fern_02_nor_gl_1k.jpg",
        "bytes": 367222,
        "sha256": "45bce132c6e96a0864bc89ab5da51361ab3f4afa83a6669ae499ab5ca811f621"
      },
      {
        "path": "art/sources/fern_02/textures/fern_02_rgba_1k.png",
        "bytes": 838210,
        "sha256": "c53438a086f4021e9ac4e95b71a93fada1e5c2632c9ce8e90fb2287b1d49e1cc"
      },
      {
        "path": "art/sources/grass_medium_01/grass_medium_01.bin",
        "bytes": 41156,
        "sha256": "e0754e54862356ff727e95155aa7221355acc94b557cdf9df0ee9743997ed0b2"
      },
      {
        "path": "art/sources/grass_medium_01/grass_medium_01.gltf",
        "bytes": 3552,
        "sha256": "c427c0e7741c42b590f53d929af283a5cc77c51d2a74e76155d59b1f2c91c954"
      },
      {
        "path": "art/sources/grass_medium_01/textures/grass_medium_01_alpha_1k.png",
        "bytes": 648718,
        "sha256": "711a8e49af758d6a6ce1f610db858899a27be19da6d1866bd35c13bc7b8ffeff"
      },
      {
        "path": "art/sources/grass_medium_01/textures/grass_medium_01_arm_1k.jpg",
        "bytes": 679518,
        "sha256": "9a3a30f72bc02f4398967c5b08f2d20cce30bd423a2613b42a727034296fa3ae"
      },
      {
        "path": "art/sources/grass_medium_01/textures/grass_medium_01_diff_1k.jpg",
        "bytes": 395673,
        "sha256": "71495bd6a11fddcab0aaff38246fea1a7b802a705483f1c7cbca53955daa8050"
      },
      {
        "path": "art/sources/grass_medium_01/textures/grass_medium_01_nor_gl_1k.jpg",
        "bytes": 956166,
        "sha256": "cae298d3d1d7ff7c7e210ad8ac772b96706e356f9315a6b04fde373ce01ccf1e"
      },
      {
        "path": "art/sources/grass_medium_01/textures/grass_medium_01_rgba_1k.png",
        "bytes": 840009,
        "sha256": "2032d52cea9650f763c98bd14841f2fa51e3358843a3e24420fec4e1732608f2"
      },
      {
        "path": "art/sources/manifest.json",
        "bytes": 3093,
        "sha256": "105d97a207627292e5a11ef1feab91da3a7ec65bd455f1a9837afc92d4bcea09"
      },
      {
        "path": "art/textures/bark_brown_02_diff_1k.jpg",
        "bytes": 659592,
        "sha256": "920fa0bed0c9d78c1d530e99795113afd532d7db746de440f4a85d7c83ed0f1a"
      },
      {
        "path": "art/textures/bark_brown_02_nor_gl_1k.jpg",
        "bytes": 1015623,
        "sha256": "0d5e691e8ad8bcd093a3587887fda2a6b4a948b5708a4f256f7919584c6eb857"
      },
      {
        "path": "art/textures/bark_brown_02_rough_1k.jpg",
        "bytes": 337946,
        "sha256": "68125592de36e15bae7aa6db85c4d135aeb7e5653199ba226483a70f6d69837d"
      },
      {
        "path": "art/textures/forest-granite-diff.jpg",
        "bytes": 510948,
        "sha256": "ff40a03843e0bae5cb4f055cd3db7dd41c2369543ebdf24ca2d92bb2464881f6"
      },
      {
        "path": "art/textures/pine_tree_01_twig_alpha_1k.png",
        "bytes": 351928,
        "sha256": "6f91aa99f2c27108d6f817f874954aa7df8bfbb4dea2673e9322555a6ae79d99"
      },
      {
        "path": "art/textures/pine_tree_01_twig_diff_1k.jpg",
        "bytes": 510932,
        "sha256": "e649f0f9bc74d1af5f1a45eaf2fe7a29adaaddfab251f746b983da301e4b80e1"
      },
      {
        "path": "art/textures/pine-spray.png",
        "bytes": 1210488,
        "sha256": "5db8c5d6f927b4908adabbca9182c759f05bc08395fae19bdf2ece304f59a3a9"
      },
      {
        "path": "art/textures/rock_boulder_cracked_diff_1k.jpg",
        "bytes": 998110,
        "sha256": "e88c9e50109c7f610bc380a00b9bdac5954c392bb02134dedeea3358da57276a"
      },
      {
        "path": "art/textures/rock_boulder_cracked_nor_gl_1k.jpg",
        "bytes": 1079683,
        "sha256": "022000a37cb91457de2e0c738baebbc1b0b8eb864ba99321d07c248d5c0741bc"
      },
      {
        "path": "art/textures/rock_boulder_cracked_rough_1k.jpg",
        "bytes": 379850,
        "sha256": "47e6c4b43c9cc5331d0392e3f74777f9a6712edda141dd148586b404c6c30e73"
      },
      {
        "path": "art/textures/timber-endgrain.jpg",
        "bytes": 63310,
        "sha256": "14d2d1635f7a24020c813a81990e93878d09ecb1923ff734630fb8c5fc9fd2cd"
      },
      {
        "path": "eslint.config.js",
        "bytes": 682,
        "sha256": "c12f4d1e76dad60975bc48b18ab8ff7d082db2c02292a980490684a33be3ebfc"
      },
      {
        "path": "index.html",
        "bytes": 1024,
        "sha256": "167b2b358403837e794c3c8b477e574812514b2fe18cd73a10befa8b06f60c75"
      },
      {
        "path": "package-lock.json",
        "bytes": 73937,
        "sha256": "af259c4c6449e475c2f14d1c880d175a480595d672ff975f4645f9fbe6bf9831"
      },
      {
        "path": "package.json",
        "bytes": 1491,
        "sha256": "f22130b47dee8a81cb531c2c9b6ed694998a8fe97d08885b0e1c392cc2af20c0"
      },
      {
        "path": "public/assets/ASSETS.md",
        "bytes": 6083,
        "sha256": "e525a52a51557f3fb45edca5f98d6c7815247eb8af1404f622369631cd0d3170"
      },
      {
        "path": "public/assets/forest-kit.glb",
        "bytes": 11457108,
        "sha256": "ca7a1a9b2112e62f78eb993cac034505df27d56b84c64c897631e05c0822ccd6"
      },
      {
        "path": "public/assets/textures/forest-floor-color.jpg",
        "bytes": 1195394,
        "sha256": "cfa40bc9d9417d1852db8753a8d5917f110c40101179f63543c382e39bc05e4a"
      },
      {
        "path": "public/assets/textures/forest-floor-normal.jpg",
        "bytes": 1466049,
        "sha256": "832328216adc0a7e1f70a31d5ee48c9ab7f2152d83816122736cf42ac4b2ebd6"
      },
      {
        "path": "public/assets/textures/forest-floor-roughness.jpg",
        "bytes": 511385,
        "sha256": "0c2a1d91aacb8e54a496051b59854e51e456fe858abeade778e308359ef16463"
      },
      {
        "path": "public/assets/textures/path-color.jpg",
        "bytes": 501955,
        "sha256": "df3f135c899f10a3b018738343b222cbc67d13e7c76c5d8da834a3d34c984417"
      },
      {
        "path": "public/assets/textures/path-normal.jpg",
        "bytes": 1011780,
        "sha256": "ac517ca39eb507ae0f27e2b3db431c60888f9b5c3c52bec49d2c0775da0920cb"
      },
      {
        "path": "public/assets/textures/path-roughness.jpg",
        "bytes": 340815,
        "sha256": "ae9fb57c1173ccb4579f40edf8321a30bdca815042ffd72015a2a707c7e2e7ba"
      },
      {
        "path": "public/assets/textures/SOURCES.md",
        "bytes": 753,
        "sha256": "769273c378218c23d81036fad55ae4eaf400d0bf1562904224eed42cfccc12c7"
      },
      {
        "path": "public/favicon.svg",
        "bytes": 229,
        "sha256": "41566d99fc788306ae1514f73ede320b48a1dc0a03876ebf2e1b0fcdf44b9ab4"
      },
      {
        "path": "public/fonts/Barlow-OFL.txt",
        "bytes": 4376,
        "sha256": "10b0e6bb43166a50fbe7cde2895bd7f703738a5da843acb5c97c95dc9ea26817"
      },
      {
        "path": "public/fonts/barlow-regular.ttf",
        "bytes": 82624,
        "sha256": "a35caa4687f434d66453c1fe423d7074cfa9fd7ab80c19b0780f3862887d2fc9"
      },
      {
        "path": "README.md",
        "bytes": 2326,
        "sha256": "2333e2becceb5e3681d649aecff7dcbe4517f4919536f048cad9424bfcbe3256"
      },
      {
        "path": "ROADMAP.md",
        "bytes": 2427,
        "sha256": "d64e7ace503008fcaa1cc1b6ac82ff3e4ffcf7e97d92d6cec20ff681cec0c9e3"
      },
      {
        "path": "scripts/build-assets.mjs",